lang	pool	kind	meta	value
la	outcome.success.easy.pool	COUNT	17	17
la	outcome.success.easy.pool	ENGLISH_LIKE	1	"You’ve made it.
The truth remains."
la	outcome.success.easy.pool	ENGLISH_LIKE	2	"Even if it was only a small step,
you held your ground."
la	outcome.success.easy.pool	ENGLISH_LIKE	3	"You listened.
 The path opened."
la	outcome.success.easy.pool	ENGLISH_LIKE	4	"> You made it here
> 
> The rules were simple —
> 
> the choice was yours."
la	outcome.success.easy.pool	ENGLISH_LIKE	5	"> Distance became meaning.
> 
> and time answered your footsteps."
la	outcome.success.easy.pool	ENGLISH_LIKE	6	"> Not everything shines forever.
> 
> But this moment did."
la	outcome.success.easy.pool	ENGLISH_LIKE	7	"Light fell evenly, ,
and every shadow vanished."
la	outcome.success.easy.pool	ENGLISH_LIKE	8	"The wind fell silent.
and everything returned to where it belonged."
la	outcome.success.easy.pool	ENGLISH_LIKE	9	"A moment of silence.
The world steadied its breath."
la	outcome.success.easy.pool	ENGLISH_LIKE	10	"The record is etched deep in the sand—
beyond the reach of the wind."
la	outcome.success.easy.pool	ENGLISH_LIKE	11	"Harmony was restored.
Everything had been for this moment."
la	outcome.success.easy.pool	ENGLISH_LIKE	12	"Time slipped by in silence,
tucked away in the corners of memory."
la	outcome.success.easy.pool	ENGLISH_LIKE	13	"The sky shifted in color,
and one story came to its end."
la	outcome.success.easy.pool	ENGLISH_LIKE	14	"The waves grew calm,
and the sea hid its depths once more."
la	outcome.success.easy.pool	ENGLISH_LIKE	15	"The footsteps stopped,
and only the place remained."
la	outcome.success.easy.pool	ENGLISH_LIKE	16	"Victory and defeat 
are nothing more than grains of sand."
la	outcome.success.easy.pool	ENGLISH_LIKE	17	"The road goes on—or it ends.
Either way, it lies on the same earth."
la	outcome.success.normal.pool	COUNT	35	35
la	outcome.success.normal.pool	ENGLISH_LIKE	1	"The distance has found its meaning.
Time has rewarded your journey."
la	outcome.success.normal.pool	ENGLISH_LIKE	2	"The time is up.
but the rest is far from over."
la	outcome.success.normal.pool	ENGLISH_LIKE	3	"The axis is found.
the world has cased its motion."
la	outcome.success.normal.pool	ENGLISH_LIKE	4	"The glass held its breath,
and you held your ground."
la	outcome.success.normal.pool	ENGLISH_LIKE	5	"Under the stillness of the sky,
your spirit did not waver."
la	outcome.success.normal.pool	ENGLISH_LIKE	6	"Few things shine forever.
but this moment was radiant."
la	outcome.success.normal.pool	ENGLISH_LIKE	7	"You traversed the fragile earth,
without losing the view."
la	outcome.success.normal.pool	ENGLISH_LIKE	8	"The moment has passed.
The legacy remains."
la	outcome.success.normal.pool	ENGLISH_LIKE	10	"The sky knows no pause in endless circle,
nor shall you find yours."
la	outcome.success.normal.pool	ENGLISH_LIKE	11	"The center has been reached.
The world stood still."
la	outcome.success.normal.pool	ENGLISH_LIKE	12	"Finally here.
The truth remains unyielding."
la	outcome.success.normal.pool	ENGLISH_LIKE	13	"You have seen it through.
And mark this: it was you, and no one else, who chose this path."
la	outcome.success.normal.pool	ENGLISH_LIKE	14	"Time drifted into silence,
finding its place in the recesses of the mind."
la	outcome.success.normal.pool	ENGLISH_LIKE	15	"As the sky transformed,
the tale found its final resolved."
la	outcome.success.normal.pool	ENGLISH_LIKE	16	"The waters fell calm,
and the sky once more veiled its abyss."
la	outcome.success.normal.pool	ENGLISH_LIKE	17	"The footsteps ceased,
only the place remained."
la	outcome.success.normal.pool	ENGLISH_LIKE	18	"Light fell evenly, ,
and every shadow vanished."
la	outcome.success.normal.pool	ENGLISH_LIKE	19	"The wind fell silent.
and everything returned to where it belonged."
la	outcome.success.normal.pool	ENGLISH_LIKE	20	"A moment of silence.
The world steadied its breath."
la	outcome.success.normal.pool	ENGLISH_LIKE	21	"The record is etched deep in the sand—
beyond the reach of the wind."
la	outcome.success.normal.pool	ENGLISH_LIKE	22	"Harmony was restored.
Everything had been for this moment."
la	outcome.success.normal.pool	ENGLISH_LIKE	23	"RUN COMPLETE.
Clear. Found it.
That's enough."
la	outcome.success.normal.pool	ENGLISH_LIKE	24	"RUN COMPLETE.
The path held.
So did you."
la	outcome.success.normal.pool	ENGLISH_LIKE	25	"The sky has kept moving.
So can you."
la	outcome.success.normal.pool	ENGLISH_LIKE	26	"RUN COMPLETE.
A quiet result.
The weight of real work."
la	outcome.success.normal.pool	ENGLISH_LIKE	27	"You only walked the path
the world had laid out for you."
la	outcome.success.normal.pool	ENGLISH_LIKE	28	"The ground didn’t give way.
It trusted your steps."
la	outcome.success.normal.pool	ENGLISH_LIKE	29	"This moment aligned
with the stars’ ancient rhythm."
la	outcome.success.normal.pool	ENGLISH_LIKE	30	"You didn’t take anything.
 You understood something."
la	outcome.success.normal.pool	ENGLISH_LIKE	31	"You didn’t gain a thing.
You only saw the truth for what it was."
la	outcome.success.normal.pool	ENGLISH_LIKE	32	"You didn’t take this place.
You belonged here."
la	outcome.success.normal.pool	ENGLISH_LIKE	33	"You walked a road
older than memory itself."
la	outcome.success.normal.pool	ENGLISH_LIKE	34	"The earth did not resist.
It recognized you."
la	outcome.success.normal.pool	ENGLISH_LIKE	35	"This moment aligned
 with the stillness of the stars."
la	outcome.success.hard.pool	COUNT	32	32
la	outcome.success.hard.pool	ENGLISH_LIKE	1	"In the north wind,
clarity outlasts speed."
la	outcome.success.hard.pool	ENGLISH_LIKE	2	"The center was found.
 The world came to rest."
la	outcome.success.hard.pool	ENGLISH_LIKE	3	"The stars stay silent.
Your record does the speaking."
la	outcome.success.hard.pool	ENGLISH_LIKE	4	"The result  remained.
The position changed."
la	outcome.success.hard.pool	ENGLISH_LIKE	5	"Between ice and glass,
you chose control."
la	outcome.success.hard.pool	ENGLISH_LIKE	6	"The waves fell quiet,
and the sea reclaimed its hidden depths."
la	outcome.success.hard.pool	ENGLISH_LIKE	7	"Some treasures still await.
Next time, a different path."
la	outcome.success.hard.pool	ENGLISH_LIKE	8	"The sky didn’t change.
You did."
la	outcome.success.hard.pool	ENGLISH_LIKE	9	"The moment passed.
What remained was order."
la	outcome.success.hard.pool	ENGLISH_LIKE	10	"Winter is honest.
So was your run."
la	outcome.success.hard.pool	ENGLISH_LIKE	11	"The stars aligned for a moment.
You noticed."
la	outcome.success.hard.pool	ENGLISH_LIKE	12	"The distance closed.
Time did not."
la	outcome.success.hard.pool	ENGLISH_LIKE	13	"The world’s rules stood firm.
 And the signal of possibility was real."
la	outcome.success.hard.pool	ENGLISH_LIKE	14	"The path closed quietly.
You were already through."
la	outcome.success.hard.pool	ENGLISH_LIKE	15	"Nothing changed.
Only your position did."
la	outcome.success.hard.pool	ENGLISH_LIKE	17	"The moment passed.
The record remains."
la	outcome.success.hard.pool	ENGLISH_LIKE	18	"The outcome didn’t change.
Still, you moved forward."
la	outcome.success.hard.pool	ENGLISH_LIKE	19	"The output didn’t change.
But you reached a new level."
la	outcome.success.hard.pool	ENGLISH_LIKE	20	"The ending was the same.
But the one who reached it had changed."
la	outcome.success.hard.pool	ENGLISH_LIKE	21	"The destination is the same
—but you’re no longer the traveler you once were."
la	outcome.success.hard.pool	ENGLISH_LIKE	22	"Light fell evenly, ,
and every shadow vanished."
la	outcome.success.hard.pool	ENGLISH_LIKE	23	"The wind fell silent.
and everything returned to where it belonged."
la	outcome.success.hard.pool	ENGLISH_LIKE	24	"A moment of silence.
The world steadied its breath."
la	outcome.success.hard.pool	ENGLISH_LIKE	25	"The record is etched deep in the sand—
beyond the reach of the wind."
la	outcome.success.hard.pool	ENGLISH_LIKE	26	"Harmony was restored.
Everything had been for this moment."
la	outcome.success.hard.pool	ENGLISH_LIKE	27	"Time slipped by in silence,
tucked away in the corners of memory."
la	outcome.success.hard.pool	ENGLISH_LIKE	28	"The sky shifted in color,
and one story came to its end."
la	outcome.success.hard.pool	ENGLISH_LIKE	29	"The waves grew calm,
and the sea hid its depths once more."
la	outcome.success.hard.pool	ENGLISH_LIKE	30	"The footsteps stopped,
and only the place remained."
la	outcome.success.hard.pool	ENGLISH_LIKE	31	"Victory and defeat 
are nothing more than grains of sand."
la	outcome.success.hard.pool	ENGLISH_LIKE	32	"The road goes on—or it ends.
Either way, it lies on the same earth."
la	outcome.timeup.easy.pool	COUNT	16	16
la	outcome.timeup.easy.pool	ENGLISH_LIKE	1	"Time ran out.
Nothing else did."
la	outcome.timeup.easy.pool	ENGLISH_LIKE	2	"The treasure can wait.
So can you."
la	outcome.timeup.easy.pool	ENGLISH_LIKE	4	"That’s all for now.
On to the next step."
la	outcome.timeup.easy.pool	ENGLISH_LIKE	5	"You're still here.
That’s what matters."
la	outcome.timeup.easy.pool	ENGLISH_LIKE	6	"The run ended.
You didn’t."
la	outcome.timeup.easy.pool	ENGLISH_LIKE	7	"TIME'S UP.
The run ended.
You didn't."
la	outcome.timeup.easy.pool	ENGLISH_LIKE	8	"TIME'S UP.
The rules don’t change.
Again."
la	outcome.timeup.easy.pool	ENGLISH_LIKE	9	"TIME'S UP.
“So close” is real."
la	outcome.timeup.easy.pool	ENGLISH_LIKE	10	"The sun sank,
and shadow covered the world once again."
la	outcome.timeup.easy.pool	ENGLISH_LIKE	11	"The last grains of sand fell,
and the story quietly came to a close."
la	outcome.timeup.easy.pool	ENGLISH_LIKE	12	"The wind swept through,
and the footprints vanished without a trace."
la	outcome.timeup.easy.pool	ENGLISH_LIKE	13	"The tide came in,
What once had been there returned to the sea."
la	outcome.timeup.easy.pool	ENGLISH_LIKE	14	"Silence.
Only time passed through."
la	outcome.timeup.easy.pool	ENGLISH_LIKE	15	"Victory and defeat 
are nothing more than grains of sand."
la	outcome.timeup.easy.pool	ENGLISH_LIKE	16	"The road goes on—or it ends.
Either way, it lies on the same earth."
la	outcome.timeup.normal.pool	COUNT	20	20
la	outcome.timeup.normal.pool	ENGLISH_LIKE	1	"The distance closed.
Time did not."
la	outcome.timeup.normal.pool	ENGLISH_LIKE	2	"The world kept its rules.
You touched the edge."
la	outcome.timeup.normal.pool	ENGLISH_LIKE	3	"You didn’t make it.
But the signal was real."
la	outcome.timeup.normal.pool	ENGLISH_LIKE	4	"Some treasures still await.
Let’s try a different path."
la	outcome.timeup.normal.pool	ENGLISH_LIKE	5	"The result remained.
The position changed."
la	outcome.timeup.normal.pool	ENGLISH_LIKE	6	"Time ran out.
Meaning didn't."
la	outcome.timeup.normal.pool	ENGLISH_LIKE	7	"So close.
The sound said so."
la	outcome.timeup.normal.pool	ENGLISH_LIKE	8	"The map is still open.
Come back to it."
la	outcome.timeup.normal.pool	ENGLISH_LIKE	9	"The world’s rules stood firm.
The signal of possibility was real."
la	outcome.timeup.normal.pool	ENGLISH_LIKE	10	The world kept its rules.
la	outcome.timeup.normal.pool	ENGLISH_LIKE	11	"The moment passed.
The record remains."
la	outcome.timeup.normal.pool	ENGLISH_LIKE	12	"The sun sank,
and shadow covered the world once again."
la	outcome.timeup.normal.pool	ENGLISH_LIKE	13	"The last grains of sand fell,
and the story quietly came to a close."
la	outcome.timeup.normal.pool	ENGLISH_LIKE	14	"The wind swept through,
and the footprints vanished without a trace."
la	outcome.timeup.normal.pool	ENGLISH_LIKE	15	"The tide came in,
What once had been there returned to the sea."
la	outcome.timeup.normal.pool	ENGLISH_LIKE	16	"Silence.
Only time passed through."
la	outcome.timeup.normal.pool	ENGLISH_LIKE	17	"Victory and defeat 
are nothing more than grains of sand."
la	outcome.timeup.normal.pool	ENGLISH_LIKE	18	"The road goes on—or it ends.
Either way, it lies on the same earth."
la	outcome.timeup.normal.pool	ENGLISH_LIKE	19	"> Time ran out.
> 
> Nothing else did."
la	outcome.timeup.normal.pool	ENGLISH_LIKE	20	"> The outcome didn’t change.
> 
> But your position did."
la	outcome.timeup.hard.pool	COUNT	38	38
la	outcome.timeup.hard.pool	ENGLISH_LIKE	1	"Even the aurora fades.
Come back with a new stride."
la	outcome.timeup.hard.pool	ENGLISH_LIKE	2	"In a fragile world,
haste shatters clarity before it can be found."
la	outcome.timeup.hard.pool	ENGLISH_LIKE	3	"The moment slipped away.
The meaning did not."
la	outcome.timeup.hard.pool	ENGLISH_LIKE	4	"Winter is patient.
Be the same."
la	outcome.timeup.hard.pool	ENGLISH_LIKE	5	"The sky kept moving.
So will you."
la	outcome.timeup.hard.pool	ENGLISH_LIKE	6	"The story moves on.
The end is not yet."
la	outcome.timeup.hard.pool	ENGLISH_LIKE	7	"The stars were there, watching.
Again."
la	outcome.timeup.hard.pool	ENGLISH_LIKE	8	"Ice takes its time.
Neither do you."
la	outcome.timeup.hard.pool	ENGLISH_LIKE	9	"The sky kept moving.
So can you."
la	outcome.timeup.hard.pool	ENGLISH_LIKE	10	"The north has learned to wait.
So should you."
la	outcome.timeup.hard.pool	ENGLISH_LIKE	12	"Like drifting clouds,
don’t lose your flow—like a river."
la	outcome.timeup.hard.pool	ENGLISH_LIKE	13	"The sound was near.
The distance was real.
But that moment can’t be saved."
la	outcome.timeup.hard.pool	ENGLISH_LIKE	14	"You were closing in.
Only time wasn’t."
la	outcome.timeup.hard.pool	ENGLISH_LIKE	15	"The world held to its rules.
You touched the edge of them."
la	outcome.timeup.hard.pool	ENGLISH_LIKE	16	"You didn’t reach the treasure. 
But the signal was real."
la	outcome.timeup.hard.pool	ENGLISH_LIKE	17	"Nothing changed.
Only your position did."
la	outcome.timeup.hard.pool	ENGLISH_LIKE	19	"The moment slipped away,
but the record stayed."
la	outcome.timeup.hard.pool	ENGLISH_LIKE	20	"You crossed fragile ground
and left the horizon unbroken."
la	outcome.timeup.hard.pool	ENGLISH_LIKE	21	"Nothing changed.
 Only your position did.
Not luck.
Alignment.
The moment passed.
The record remains."
la	outcome.timeup.hard.pool	ENGLISH_LIKE	22	"The sun sank,
and shadow covered the world once again."
la	outcome.timeup.hard.pool	ENGLISH_LIKE	23	"The last grains of sand fell,
and the story quietly came to a close."
la	outcome.timeup.hard.pool	ENGLISH_LIKE	24	"The wind swept through,
and the footprints vanished without a trace."
la	outcome.timeup.hard.pool	ENGLISH_LIKE	25	"The tide came in,
What once had been there returned to the sea."
la	outcome.timeup.hard.pool	ENGLISH_LIKE	26	"Silence.
Only time passed through."
la	outcome.timeup.hard.pool	ENGLISH_LIKE	27	"Victory and defeat 
are nothing more than grains of sand."
la	outcome.timeup.hard.pool	ENGLISH_LIKE	28	"The road goes on—or it ends.
Either way, it lies on the same earth."
la	outcome.timeup.hard.pool	ENGLISH_LIKE	29	"The season closed.
The land remained."
la	outcome.timeup.hard.pool	ENGLISH_LIKE	30	"The path The path remains.
Only your steps stopped."
la	outcome.timeup.hard.pool	ENGLISH_LIKE	31	"Your time ran out.
The sky didn’t."
la	outcome.timeup.hard.pool	ENGLISH_LIKE	33	"The world is still intact.
You can return—changed."
la	outcome.timeup.hard.pool	ENGLISH_LIKE	34	"The season ended.
The forest remains."
la	outcome.timeup.hard.pool	ENGLISH_LIKE	35	"The distance was closing.
Time kept its rhythm."
la	outcome.timeup.hard.pool	ENGLISH_LIKE	36	"Your time came to a halt.
The sky kept moving."
la	outcome.timeup.hard.pool	ENGLISH_LIKE	38	"The path is still here.
You can come back—changed."
